"Pass the gin, I mix it with American blood",Kendrick Lamar
Said they killed his only son because of insufficient funds,Kendrick Lamar
Take the gratitude from him,Kendrick Lamar
"Talkin' out his head, philosophin' on what the Lord had done",Kendrick Lamar
"Tell me what you do for love, loyalty, and passion of",Kendrick Lamar
The great American flag is wrapped in drag with explosives,Kendrick Lamar
"Then bash him in, you Crippin' or you married to Blood?",Kendrick Lamar
"Then roll the dice, then bet us up",Kendrick Lamar
This country is to me a sound,Kendrick Lamar
Throw a steak off the ark,Kendrick Lamar
"To a pool full of sharks, he'll take it",Kendrick Lamar
"To the spiritual, my spirit do no better, but I told him",Kendrick Lamar
"Touch my daddy, touch my niece",Kendrick Lamar
"Touch my nephew, touch my brother",Kendrick Lamar
"Touch my sister, touch my woman",Kendrick Lamar
"Walk myself to the court like, ""Bitch, I did that!""",Kendrick Lamar
"Wall Street, corporate offices",Kendrick Lamar
We lost Barack and promised to never doubt him again,Kendrick Lamar
"With a sworn nemesis, he'll make it",Kendrick Lamar
X-rated,Kendrick Lamar
Yesterday I got a call like from my dog like 101,Kendrick Lamar
You close your eyes to look around,Kendrick Lamar
"You overnight the big rifles, then tell Fox to be scared of us",Kendrick Lamar
"You should chip a nigga, then throw the blower in his lap",Kendrick Lamar
"(Smoke somethin', nigga!)",Kendrick Lamar
"A couple drive-by's in the hood lately, shit",Kendrick Lamar
"Ain't no peace treaty, just piecin' BGs up to pre-approve",Kendrick Lamar
"Alondra, Rosecrans, Bullis, it's Compton",Kendrick Lamar
And a bird and ten grand's where a mothafucka stand,Kendrick Lamar
And it's safe to say that our next generation maybe can sleep,Kendrick Lamar
And niggas that rep colors is doin' the same thang,Kendrick Lamar
And they wonder why I rarely smoke now,Kendrick Lamar
At the same burger stand where *beep* hang out,Kendrick Lamar
"Aw man, goddamn, all hell broke loose",Kendrick Lamar
Block a nigga in,Kendrick Lamar
"Bodies on top of bodies, IVs on top of IVs",Kendrick Lamar
"Brace yourself, I'll take you on a trip down memory lane",Kendrick Lamar
"But ever since that day, I was lookin' at him different",Kendrick Lamar
"But yeah, that's like me, I grew up in the hood where they bang",Kendrick Lamar
Cluck heads all up and down the block and shit,Kendrick Lamar
Cocaine laced in marijuana,Kendrick Lamar
Compton,Kendrick Lamar
Constantly drinkin' and drive,Kendrick Lamar
Couple of IV's with the fuckin' spray-can,Kendrick Lamar
"Crew I'm finna slay, the street life I crave",Kendrick Lamar
"Deal with the outcome, a strap in the hand",Kendrick Lamar
"Dip, make a nigga flip",Kendrick Lamar
Don't even trip,Kendrick Lamar
"Down the boulevard with the pistol grip, yeah",Kendrick Lamar
Fresh outta school 'cause I was a high school grad',Kendrick Lamar
"Fuck you shootin' for if you ain't walkin' up, you fuckin' punk?",Kendrick Lamar
"G-yeah, cocaine, weed",Kendrick Lamar
"G-yeah, how we do",Kendrick Lamar
"G-yeah, real simple and plain",Kendrick Lamar
"Go buy a chopper and have a doctor on speed dial, I guess",Kendrick Lamar
"Hey, Dot, you good, my nigga?",Kendrick Lamar
"Hit the light pole, two niggas hopped out on foot and dashed",Kendrick Lamar
"Hit the powder, then watch this flame that arrive in his eye",Kendrick Lamar
"Hood ('Sup, Cuz?)",Kendrick Lamar
I made allegiance that made a promise to see you bleedin',Kendrick Lamar
"I was straight tweakin', the next weekend we broke even",Kendrick Lamar
"I'm still in the hood, loc, yeah that's cool",Kendrick Lamar
"If I mentioned all of my skeletons, would you jump in the seat?",Kendrick Lamar
"If I told you I killed a nigga at sixteen, would you believe me?",Kendrick Lamar
If Pirus and Crips all got along,Kendrick Lamar
Imagine if your first blunt had you foamin' at the mouth,Kendrick Lamar
"In fact, I got fired, 'cause I was inspired by all of my friends",Kendrick Lamar
Instead of boy with a chopper that hold the cul-de-sac hostage,Kendrick Lamar
It ain't nothin' but a Compton thang,Kendrick Lamar
"It got ugly, wavin' yo' hand out the window – check yourself!",Kendrick Lamar
"It was me, L Boog, and Yan Yan, YG Lucky ride down Rosecrans",Kendrick Lamar
Just lay back and drink that,Kendrick Lamar
"Kendrick a.k.a. ""Compton's Human Sacrifice""",Kendrick Lamar
Kill 'em all if they gossip,Kendrick Lamar
Let me teach you some lessons about the street,Kendrick Lamar
"Listen, coward, the concept is aim and then bang it and slide",Kendrick Lamar
"Live inside the belly of the rough, Compton, USA",Kendrick Lamar
M.A.A.d city,Kendrick Lamar
Made me an Angel on Angel Dust - what?,Kendrick Lamar
Make sure you're corporate or they'll be callin' your mother collect,Kendrick Lamar
"Man down, where you from, nigga?",Kendrick Lamar
"Mount up, regulators in the whip",Kendrick Lamar
"My pops said I needed a job, I thought I believed him",Kendrick Lamar
"Nigga, pass Dot the bottle, damn!",Kendrick Lamar
"Nigga, shut up!",Kendrick Lamar
"Nigga, that ain't no word",Kendrick Lamar
Niggas always actin' unsensitive and shit,Kendrick Lamar
"Niggas been mixin' shit since the '80s, loc",Kendrick Lamar
"Not the drill sergeant, but the stress that weighin' on your brain",Kendrick Lamar
Now crawl your head in that noose,Kendrick Lamar
Now this is not a tape recorder sayin' that he did it,Kendrick Lamar
Obviously the coroner between the sheets like the Isleys,Kendrick Lamar
"Of livin' a lie, drown their body with toxins",Kendrick Lamar
One time's crooked and shit,Kendrick Lamar
Or see me to be innocent Kendrick you seen in the street,Kendrick Lamar
"Out that bitch with deposit, a price on his head, the tithes",Kendrick Lamar
Pack a van with four guns at a time,Kendrick Lamar
"Pakistan on every porch is fine, we adapt to crime",Kendrick Lamar
Pass it to the left so I can smoke on me,Kendrick Lamar
"Pickin' up the fuckin' pump, pickin' off you suckers",Kendrick Lamar
"Probably go to the projects, I",Kendrick Lamar
"Projects tore up, gang signs get thrown up",Kendrick Lamar
"Reality struck, I seen the white car crash",Kendrick Lamar
Security guard for a month and ended up leavin',Kendrick Lamar
Seem like the whole city go against me,Kendrick Lamar
Seen a light-skinned nigga with his brains blown out,Kendrick Lamar
"Sherm sticks, butt-nakeds",Kendrick Lamar
"Shit, the hood took me under, so I follow the rules",Kendrick Lamar
"Shots hit the enemy, hearts turn brave",Kendrick Lamar
"Shots in the crowd, then everybody ran",Kendrick Lamar
Sleepin' in the living room of my momma's pad,Kendrick Lamar
"So, loc, grab a strap 'cause yeah, it's so real, yeah",Kendrick Lamar
Suck a dick or die or sucker punch,Kendrick Lamar
"That was back when I was nine, Joey packed the nine",Kendrick Lamar
That's what Momma said when we was eatin' that free lunch,Kendrick Lamar
"The Children of the Corn, they vandalizin' the option",Kendrick Lamar
"They say the governor collect all of our taxes, except",Kendrick Lamar
They'd probably gun me down by the end of this song,Kendrick Lamar
This is cul-de-sac and plenty Cognac and major pain,Kendrick Lamar
This is not a rap on how I'm slingin' crack or move cocaine,Kendrick Lamar
"This m.A.A.d city I run, my nigga",Kendrick Lamar
To stage a robbery the third Saturday I clocked in,Kendrick Lamar
"Trip, we in the hood still",Kendrick Lamar
"Uh, Warriors and Conans, hope euphoria can slow dance",Kendrick Lamar
Wake yo' punk-ass up!,Kendrick Lamar
What you holdin' it for?,Kendrick Lamar
"When we in traffic and tragic happens, that shit ain't no threat",Kendrick Lamar
"When you hop on that trolley, make sure your color's correct",Kendrick Lamar
"Where your grandma stay, huh, my nigga?",Kendrick Lamar
With a basketball and some Now and Laters to eat?,Kendrick Lamar
With dreams of bein' a lawyer or doctor,Kendrick Lamar
"With society, the driver seat the first one to get killed",Kendrick Lamar
"With the sliding door, fuck is up?",Kendrick Lamar
Would you say my intelligence now is great relief?,Kendrick Lamar
YAWK! YAWK! YAWK! YAWK!,Kendrick Lamar
You ain't the one that got fucked up,Kendrick Lamar
"You killed my cousin back in '94, fuck yo' truce!",Kendrick Lamar
You know the reasons but still will never know my life,Kendrick Lamar
You movin' backwards if you suggest that you sleep with a TEC,Kendrick Lamar
You wind up dead on the news,Kendrick Lamar
"(Oh yes, we can, oh yes, we can)",Kendrick Lamar
"24/7, 365 days times two",Kendrick Lamar
A little nappy-headed nigga with the world behind him,Kendrick Lamar
And I put that on my momma and my baby boo too,Kendrick Lamar
And if I gotta brown-nose for some gold,Kendrick Lamar
"Aw yeah, fuck the judge",Kendrick Lamar
"Ayy, ayy, nigga what's happenin'?",Kendrick Lamar
"Bitch, where was you when I was walkin'?",Kendrick Lamar
"Bitch, where you when I was walkin'?",Kendrick Lamar
By the time you hear the next pop,Kendrick Lamar
Do you want the funk?,Kendrick Lamar
"Everybody's suicidal, they ain't even need my help",Kendrick Lamar
From a peasant to a prince to a motherfuckin' king (oh yeah),Kendrick Lamar
"Funk, funk, funk, funk, funk, funk, funk, funk, funk, funk, funk",Kendrick Lamar
"I can dig rappin', but a rapper with a ghost writer?",Kendrick Lamar
I don't want you monkey-mouth motherfuckers,Kendrick Lamar
I got a bone to pick,Kendrick Lamar
"I made it past twenty-five, and there I was",Kendrick Lamar
"I remember you was conflicted, misusing your influence",Kendrick Lamar
"I should probably run for mayor when I'm done, to be honest",Kendrick Lamar
"I swore I wouldn't tell, but most of y'all sharing bars",Kendrick Lamar
I was contemplatin' gettin' on stage,Kendrick Lamar
"I was gonna kill a couple rappers, but they did it to themselves",Kendrick Lamar
"I'm mad (He mad!), but I ain't stressin'",Kendrick Lamar
If I shoot at your identity and bounce to the left,Kendrick Lamar
"Just to go back to the hood, see my enemy, and say… (Oh yeah)",Kendrick Lamar
"K-Dot back in the hood, nigga!",Kendrick Lamar
"King Kunta, black man taking no losses, oh yeah",Kendrick Lamar
"King Kunta, everybody wanna cut the legs off him",Kendrick Lamar
"Kunta, black man taking no losses, oh yeah",Kendrick Lamar
Life ain't shit but a fat vagina,Kendrick Lamar
Like you got the bottom bunk in a two-man cell (A two-man cell),Kendrick Lamar
Limo tinted with the gold plates,Kendrick Lamar
Manipulated Bill Clinton with desires,Kendrick Lamar
"Now I run the game, got the whole world talkin'",Kendrick Lamar
"Now if I give you the funk, you gon' take it?",Kendrick Lamar
"Screamin' ""Annie, are you okay? Annie, are you okay?""",Kendrick Lamar
Sittin' in my throne again,Kendrick Lamar
Something's in the water (Something's in the water),Kendrick Lamar
"Straight from the bottom, this the belly of the beast",Kendrick Lamar
"Stuck a flag in my city, everybody's screamin' ""Compton!""",Kendrick Lamar
The yam brought it out of Richard Pryor,Kendrick Lamar
The yam is the power that be,Kendrick Lamar
Then I'd rather be a bum than a motherfuckin' baller,Kendrick Lamar
"This shit is elementary, I'll probably go to jail",Kendrick Lamar
"True friends, one question",Kendrick Lamar
"Twenty million walkin' out the court buildin', woo woo!",Kendrick Lamar
We want the funk,Kendrick Lamar
What the fuck happened? (Oh no!),Kendrick Lamar
You can smell it when I'm walkin' down the street,Kendrick Lamar
You goat-mouth mammyfucker,Kendrick Lamar
